{
  "title": "Standardised Price List - Barringtons Test",
  "headings": {
    "h1": [
      "Standardised Price List",
      "STANDARDISED PRICE LIST"
    ],
    "h2": [
      "Standard Price List",
      "Add Your Heading Text Here",
      "Add Your Heading Text"
    ],
    "h3": [],
    "h4": [],
    "h5": [],
    "h6": []
  },
  "paragraphs": [
    "Following the Competition and Market Authority’s (CMA) market investigation into the funeral sector it is compulsory that every funeral director has a Standard Price List.The price list should be available on their website, in the window of their branch, and available to be taken away for reflection.",
    "The Standard Price List should enable you to compare funeral directors on a like-for-like basis based on the CMA’s attended funeral service and unattended funeral service specifications.",
    "The Standard Funeral Service is a set funeral package that includes all of the basic needs to make funeral arrangements, however it is not a flexible package. There are additional options that can be added to the service which are included in the Additional Options Price List at the bottom of the page. In most cases however if you do not want the fixed Standard Funeral Option the best value is achieved by choosing our bespoke service.",
    "All funeral directors are legally required to publish this Price List for a standardised set of products and services. \n        This is to help you think through your options and make choices, and to let you compare prices between different \n        funeral directors (because prices can vary).",
    "For an Attended or Unattended burial funeral, the burial fee.1\n        In this local area, the typical cost of the burial fee is: £1008-£1200",
    "For a new grave, you will also need to pay for the plot; for an existing grave with a memorial in place, you may need to pay a removal/replacement fee. In addition, the cemetery may charge a number of other fees.",
    "For an Attended cremation funeral, the cremation fee.\n        In this local area, the typical cost of a cremation is: £848-£1125",
    "Please discuss any specific religious, belief-based and/or cultural requirements that you have with the funeral director.",
    "The funeral director can give you a full list of what they can supply. They are likely to charge for these additional products and services, so you may choose to take care of some arrangements without their involvement,\n        or you can use a different supplier.",
    "Lorem ipsum dolor sit amet, consectetur adipiscing elit. Ut elit tellus, luctus nec ullamcorper mattis, pulvinar dapibus leo."
  ],
  "lists": [],
  "tables": [
    {
      "headers": [],
      "rows": [
        [
          "Taking care of all necessary legal and administrative arrangements.",
          "£995"
        ],
        [
          "Collecting and transporting the deceased person from the place of death (normally within 15 miles of the funeral director’s premises) into the funeral director’s care.",
          "£300"
        ],
        [
          "Care of the deceased person before the funeral in appropriate facilities. The deceased person will be kept at Barringtons Funeral Services branch offices.",
          "£375"
        ],
        [
          "Providing a suitable coffin – made from Wood Effect MDF or environmentally friendly Jute material.",
          "£350"
        ],
        [
          "Viewing of the deceased person for family and friends, by appointment with the funeral director (where viewing is requested by the customer).",
          "£100"
        ],
        [
          "At a date and time you agree with the funeral director, taking the deceased person direct to the agreed cemetery or crematorium (normally within 20 miles of the funeral director’s premises) in a hearse or other appropriate vehicle.",
          "£350"
        ],
        [
          "",
          "£2,470.00"
        ]
      ]
    },
    {
      "headers": [],
      "rows": [
        [
          "Burial (funeral director’s charges only)",
          "£1400"
        ],
        [
          "Cremation (funeral director’s charges plus the cremation fee)",
          "£1590"
        ]
      ]
    },
    {
      "headers": [],
      "rows": [
        [
          "Additional mileage (price per mile outside greater Liverpool Region).",
          "£1.50"
        ],
        [
          "Additional transfers of the deceased person’s body (e.g. to their home, to a place of worship).",
          "£250"
        ],
        [
          "Collection and delivery of ashes.",
          "£1"
        ],
        [
          "Embalming.",
          "£125"
        ],
        [
          "Funeral officiant (e.g. celebrant, minister of religion etc.).",
          "Prices on request"
        ],
        [
          "Services supplied outside of normal office hours.",
          "Prices on request"
        ]
      ]
    }
  ],
  "prices": [
    "£995",
    "£300",
    "£375",
    "£350",
    "£100",
    "£2,470.00",
    "£1400",
    "£1590",
    "£1008",
    "£1200",
    "£848",
    "£1125",
    "£1.50",
    "£250",
    "£1",
    "£125"
  ],
  "contacts": [],
  "addresses": [],
  "important_numbers": [
    "00"
  ],
  "fullText": "Standardised Price List Standard Price List Following the Competition and Market Authority’s (CMA) market investigation into the funeral sector it is compulsory that every funeral director has a Standard Price List.The price list should be available on their website, in the window of their branch, and available to be taken away for reflection.The Standard Price List should enable you to compare funeral directors on a like-for-like basis based on the CMA’s attended funeral service and unattended funeral service specifications.The Standard Funeral Service is a set funeral package that includes all of the basic needs to make funeral arrangements, however it is not a flexible package. There are additional options that can be added to the service which are included in the Additional Options Price List at the bottom of the page. In most cases however if you do not want the fixed Standard Funeral Option the best value is achieved by choosing our bespoke service. April 2025 STANDARDISED PRICE LIST All funeral directors are legally required to publish this Price List for a standardised set of products and services. This is to help you think through your options and make choices, and to let you compare prices between different funeral directors (because prices can vary). ATTENDED FUNERAL (funeral director’s charges only) This is a funeral where family and friends have a ceremony, event or service for the deceased person at the same time as they attend their burial or cremation. Taking care of all necessary legal and administrative arrangements. £995 Collecting and transporting the deceased person from the place of death (normally within 15 miles of the funeral director’s premises) into the funeral director’s care. £300 Care of the deceased person before the funeral in appropriate facilities. The deceased person will be kept at Barringtons Funeral Services branch offices. £375 Providing a suitable coffin – made from Wood Effect MDF or environmentally friendly Jute material. £350 Viewing of the deceased person for family and friends, by appointment with the funeral director (where viewing is requested by the customer). £100 At a date and time you agree with the funeral director, taking the deceased person direct to the agreed cemetery or crematorium (normally within 20 miles of the funeral director’s premises) in a hearse or other appropriate vehicle. £350 £2,470.00 UNATTENDED FUNERAL This is a funeral where family and friends may choose to have a ceremony, event or service for the deceased person, but they do not attend the burial or cremation itself. Burial (funeral director’s charges only) £1400 Cremation (funeral director’s charges plus the cremation fee) £1590 FEES YOU MUST PAY For an Attended or Unattended burial funeral, the burial fee.1 In this local area, the typical cost of the burial fee is: £1008-£1200 For a new grave, you will also need to pay for the plot; for an existing grave with a memorial in place, you may need to pay a removal/replacement fee. In addition, the cemetery may charge a number of other fees. For an Attended cremation funeral, the cremation fee. In this local area, the typical cost of a cremation is: £848-£1125 Please discuss any specific religious, belief-based and/or cultural requirements that you have with the funeral director. ADDITIONAL FUNERAL DIRECTOR PRODUCTS AND SERVICES This funeral director can supply a range of optional, additional products and services, or to arrange (on your behalf) for a third party to supply them. Examples include: Additional mileage (price per mile outside greater Liverpool Region). £1.50 Additional transfers of the deceased person’s body (e.g. to their home, to a place of worship). £250 Collection and delivery of ashes. £1 Embalming. £125 Funeral officiant (e.g. celebrant, minister of religion etc.). Prices on request Services supplied outside of normal office hours. Prices on request The funeral director can give you a full list of what they can supply. They are likely to charge for these additional products and services, so you may choose to take care of some arrangements without their involvement, or you can use a different supplier. 1 This fee (which is sometimes called the interment fee) is the charge made for digging and closing a new grave, or for reopening and closing an existing grave. Add Your Heading Text Here Add Your Heading Text Lorem ipsum dolor sit amet, consectetur adipiscing elit. Ut elit tellus, luctus nec ullamcorper mattis, pulvinar dapibus leo."
}